amazon-order-id	merchant-order-id	purchase-date	last-updated-date	order-status	fulfillment-channel	sales-channel	order-channel	ship-service-level	product-name	sku	asin	number-of-items	item-status	quantity	currency	item-price	item-tax	shipping-price	shipping-tax	gift-wrap-price	gift-wrap-tax	item-promotion-discount	ship-promotion-discount	ship-city	ship-state	ship-postal-code	ship-country	promotion-ids	cpf	is-business-order	purchase-order-number	price-designation	fulfilled-by	is-replacement-order	original-order-id	is-buyer-requested-cancellation	buyer-requested-cancel-reason	signature-confirmation-recommended
112-3855477-2401818	112-3855477-2401818	2025-07-22T15:08:09+00:00	2025-07-23T09:46:19+00:00	Shipped	Amazon	Amazon.com		Expedited	D-Con No View, No Touch Covered Mouse Trap, 6 Pack (2 Traps Each) (Packaging May Vary)	HYD-8001-6PK-FBA	B07Q86VPBY		Shipped	1	USD	30.6	1.84	2.99					2.99	CLEONA	PA	17042-2423	US			false				false		false		false
112-2688406-1452229	5439828	2025-07-22T15:07:51+00:00	2025-07-23T00:46:36+00:00	Shipped	Merchant	Amazon.com	WebsiteOrderChannel	Standard	K-Y Liquid Classic Water-Based Body Friendly Formula 4.5 Fl Oz Personal Lubricant for Wetter Sex for Men, Women and Couples & Safe to Use with Latex Condoms	IBH-60007	B00MJ5A8JM	1	Shipped	2	USD	29.58	2.56							SAN FRANCISCO	CA	94110-4022	US	Amazon PLCC Free-Financing Universal Merchant AFD_0ac801db-d816-46e9-918b-98		false				false		false		false
112-7566188-3422600	5439827	2025-07-22T15:07:10+00:00	2025-07-22T21:06:10+00:00	Shipped	Merchant	Amazon.com	WebsiteOrderChannel	Standard	Mucinex Sinus-Max Full Force Nasal Decongestant Spray, 2 Count	UB-40010-2PK	B01INL4AYY	1	Shipped	1	USD	21.99								SAN ANTONIO	TX	78260-4469	US			false				false		false		false
113-6159545-2305811	113-6159545-2305811	2025-07-22T15:07:02+00:00	2025-07-23T12:39:59+00:00	Shipped	Amazon	Amazon.com		Expedited	Lysol Air Sanitizer Spray, For Air Sanitization and Odor Elimination, Simple Fresh, Lavender, Cotton Blossom 10 Fl. Oz (Pack of 3)	HYL-8512-SLC-3PK-FBA	B0D2K554JF		Shipped	1	USD	31.99	2.64							GARLAND	TX	75043-5912	US			false				false		false		false
111-4756840-4716223	111-4756840-4716223	2025-07-22T15:06:49+00:00	2025-07-23T18:56:04+00:00	Shipped	Amazon	Amazon.com		Expedited	Lysol To Go Bundle - 1.5 Ounce Crisp Linen Disinfectant Spray and Lemon Lime Disinfecting Wipes Flat Pack (15 Count)	HYL-8511-8518-FBA	B0BV3C6BVY		Shipped	1	USD	9.5	0.67							OLIVE BRANCH	MS	38654-6487	US			false				false		false		false
114-4035108-0181820	5439826	2025-07-22T15:05:57+00:00	2025-07-22T21:05:34+00:00	Shipped	Merchant	Amazon.com	WebsiteOrderChannel	Standard	Jarrow Formulas MK-7 90 mcg - Bioactive Form of Vitamin K2 - 120 Servings (Softgels) - For Bone & Cardiovascular Health - Vitamin K2 MK-7 Dietary Supplement - K2 Vitamin Supplement MK-7 - Gluten Free	JF-10002	B00TOASYM8	1	Shipped	2	USD	61.0								Woodside	NY	11377	US			false				false		false		false
111-5693664-2657058	111-5693664-2657058	2025-07-22T15:05:24+00:00	2025-07-23T09:44:56+00:00	Shipped	Amazon	Amazon.com		Expedited	Lysol To Go Bundle - 1.5 Ounce Crisp Linen Disinfectant Spray and Lemon Lime Disinfecting Wipes Flat Pack (15 Count)	HYL-8511-8518-FBA	B0BV3C6BVY		Shipped	1	USD	9.5	0.63							MIDLAND PARK	NJ	07432-1236	US			false				false		false		false
113-4264353-4569830	5439825	2025-07-22T15:05:22+00:00	2025-07-23T07:07:49+00:00	Shipped	Merchant	Amazon.com	WebsiteOrderChannel	Standard	Schiff Glucosamine with Hyaluronic Acid, 2000mg Glucosamine, Joint Care Supplement Helps Lubricate & Protect Joints*, 150 Count (Pack of 2)	RB-19619-2PK	B001G7QXP2	2	Shipped	1	USD	26.0								APOPKA	FL	32703-4771	US			false				false		false		false
111-6039141-0099421	111-6039141-0099421	2025-07-22T15:04:42+00:00	2025-07-23T09:53:36+00:00	Shipped	Amazon	Amazon.com		Expedited	Air Wick Stick Ups Air Freshener, Sparkling Citrus, 2 Count (Pack of 6)	HYA-8213-6PK-FBA	B00TFVAV6S		Shipped	1	USD	13.79	1.14							KILLEEN	TX	76542-4553	US			false				false		false		false
114-7993914-6976219	5439824	2025-07-22T15:04:30+00:00	2025-07-22T21:05:35+00:00	Shipped	Merchant	Amazon.com	WebsiteOrderChannel	Standard	Lysol To Go Disinfectant Spray, Crisp Linen, Travel Size - 1.5 oz (Pack of 4)	HYL-8518-4PK	B00129JTXM	4	Shipped	1	USD	14.9	1.3							RANCHO CORDOVA	CA	95670-3624	US			false				false		false		false
111-6086701-1097021	5439823	2025-07-22T15:03:19+00:00	2025-07-23T05:06:07+00:00	Shipped	Merchant	Amazon.com	WebsiteOrderChannel	Standard	Move Free Advanced Plus MSM with Glucosamine & Chondroitin , 120 Count (Pack of 2)	RBB-19633-2PK	B00S5CL2B6	2	Shipped	1	USD	43.56								DUMONT	NJ	07628-3413	US			false				false		false		false
114-6248623-6340241	5439822	2025-07-22T15:02:23+00:00	2025-07-23T10:27:12+00:00	Shipped	Merchant	Amazon.com	WebsiteOrderChannel	Standard	Airborne 750mg Vitamin C Immune Support Supplement Gummies for Adults, Zesty Orange Flavor, Gluten Free Crafted Blend with Powerful Antioxidants Vitamins C & E, 42 Gummies (2 Pack)	RB-19579-2PK	B01LYXHMSW	2	Shipped	1	USD	27.98								APOPKA	FL	32712-5859	US			false				false		false		false
112-9626042-4388230	5439821	2025-07-22T15:01:32+00:00	2025-07-24T14:00:40+00:00	Shipped	Merchant	Amazon.com	WebsiteOrderChannel	Standard	Lysol Disinfectant Spray To Go, Crisp Linen, 1.5 Ounce (Pack of 3)	HYL-8518-3PK	B00T1S16NC	3	Shipped	1	USD	12.99	0.94							RALEIGH	NC	27616-8399	US			false				false		false		false
112-1057020-5768246	5439820	2025-07-22T15:01:32+00:00	2025-07-23T00:04:22+00:00	Shipped	Merchant	Amazon.com	WebsiteOrderChannel	Standard	NEURIVA Original Brain Supplement for Memory, Focus & Concentration + Learning & Accuracy with Clinically Tested Nootropics Phosphatidylserine and Neurofactor, Strawberry Flavor, 50 Gummies (2 Pack)	RB-19561-2PK	B088RGT7WV	2	Shipped	1	USD	64.55	5.65							Atascadero	CA	93422	US			false				false		false		false
112-5653923-3765835	5439819	2025-07-22T15:01:12+00:00	2025-07-22T21:06:09+00:00	Shipped	Merchant	Amazon.com	WebsiteOrderChannel	Standard	Durex Pleasure Ring, 1 Count	IB-60024	B071JRNKRK	1	Shipped	3	USD	31.5	2.52							Pittsford	NY	14534-9754	US			false				false		false		false
113-2508395-0226603	5439818	2025-07-22T14:58:56+00:00	2025-07-22T21:05:31+00:00	Shipped	Merchant	Amazon.com	WebsiteOrderChannel	Standard	Jarrow Formulas MK-7 90 mcg - Bioactive Form of Vitamin K2 - 120 Servings (Softgels) - For Bone & Cardiovascular Health - Vitamin K2 MK-7 Dietary Supplement - K2 Vitamin Supplement MK-7 - Gluten Free	JF-10002	B00TOASYM8	1	Shipped	1	USD	30.5	2.14							Coats	NC	27521	US			false				false		false		false
111-7797199-3934605	5439817	2025-07-22T14:58:09+00:00	2025-07-27T01:24:17+00:00	Shipped	Merchant	Amazon.com	WebsiteOrderChannel	Standard	Airborne 1000mg Vitamin C + Zinc Immune Support Supplement Chewable Tablets, Citrus Flavor with Powerful Antioxidants Vitamins A C & E, 116 Chewable Tablets (2 Pack)	RB-19621-2PK	B08F827CKW	2	Shipped	1	USD	38.49	2.39							VERMILLION	SD	57069-2720	US			false				false		false		false
113-8266793-8322630	5439816	2025-07-22T14:58:05+00:00	2025-07-22T21:05:32+00:00	Shipped	Merchant	Amazon.com	WebsiteOrderChannel	Standard	Lysol To Go Disinfectant Spray, Crisp Linen, Travel Size - 1.5 oz (Pack of 4)	HYL-8518-4PK	B00129JTXM	4	Shipped	1	USD	14.9	0.93							DARTMOUTH	MA	02747-3719	US			false				false		false		false
112-9715083-3588257	5439815	2025-07-22T14:56:15+00:00	2025-07-22T21:05:30+00:00	Shipped	Merchant	Amazon.com	WebsiteOrderChannel	Standard	Jarrow Formulas Lutein 20 mg With Zeaxanthin, Dietary Supplement for Visual Function and Macular Health Support, 120 Softgels, 120 Day Supply	JF-10005	B01LWLIOCL	1	Shipped	1	USD	27.83								AUSTIN	TEXAS	78738-6114	US			false				false		false		false
111-6482435-1876230	5439740	2025-07-22T14:56:09+00:00	2025-07-25T10:23:58+00:00	Shipped	Merchant	Amazon.com	WebsiteOrderChannel	Standard	Move Free Advanced Plus MSM Coated Tablets, Joint Health Supplement with Glucosamine and Chondroitin, 120 Count, Pack of 2	RB-19633-2PK	B00J5NVDR2	2	Shipped	1	USD	43.56								WEST LINN	OR	97068-3412	US			false				false		false		false
112-0706453-4157869	112-0706453-4157869	2025-07-22T14:55:54+00:00	2025-07-23T13:58:35+00:00	Shipped	Amazon	Amazon.com		Expedited	Lysol To Go Bundle - 1.5 Ounce Crisp Linen Disinfectant Spray and Lemon Lime Disinfecting Wipes Flat Pack (15 Count)	HYL-8511-8518-FBA	B0BV3C6BVY		Shipped	1	USD	9.5	0.67							ZEPHYRHILLS	FL	33541-2954	US			false				false		false		false
111-8698500-8998668	5439739	2025-07-22T14:55:53+00:00	2025-07-23T00:53:12+00:00	Shipped	Merchant	Amazon.com	WebsiteOrderChannel	Standard	Jarrow Formulas MK-7 90 mcg - Bioactive Form of Vitamin K2 - 120 Servings (Softgels) - For Bone & Cardiovascular Health - Vitamin K2 MK-7 Dietary Supplement - K2 Vitamin Supplement MK-7 - Gluten Free	JF-10002	B00TOASYM8	1	Shipped	1	USD	30.5	2.14							Brookville	IN	47012	US			false				false		false		false
113-5961830-6023418	5439738	2025-07-22T14:55:22+00:00	2025-07-23T09:35:11+00:00	Shipped	Merchant	Amazon.com	WebsiteOrderChannel	Standard	Jarrow Formulas MK-7 90 mcg - Bioactive Form of Vitamin K2 - 120 Servings (Softgels) - For Bone & Cardiovascular Health - Vitamin K2 MK-7 Dietary Supplement - K2 Vitamin Supplement MK-7 - Gluten Free	JF-10002	B00TOASYM8	1	Shipped	1	USD	30.5	3.16							SEATTLE	WA	98125-4035	US			false				false		false		false
114-8280097-5716211	114-8280097-5716211	2025-07-22T14:55:08+00:00	2025-07-24T01:00:04+00:00	Shipped	Amazon	Amazon.com		Expedited	Lysol To Go Bundle - 1.5 Ounce Crisp Linen Disinfectant Spray and Lemon Lime Disinfecting Wipes Flat Pack (15 Count)	HYL-8511-8518-FBA	B0BV3C6BVY		Shipped	1	USD	9.5	0.59							BROCKTON	MA	02302-1815	US			false				false		false		false
111-0198288-4596206	111-0198288-4596206	2025-07-22T14:54:48+00:00	2025-07-24T17:37:35+00:00	Pending	Amazon	Amazon.com		Expedited	Biofreeze Pain Relief Patches, Arthritis Pain Reliver, Knee & Lower Back Pain Relief Patch, Sore Muscle Relief, Neck Pain Relief, FSA Eligible, 3 Pack	TB-30004-3PK-FBA	B07Q39FSMR		Unshipped	2	USD	51.1								RIPON	CA	95366-9582	US			false				false		false		false
111-9168998-5854650	5439737	2025-07-22T14:54:39+00:00	2025-07-22T21:05:30+00:00	Shipped	Merchant	Amazon.com	WebsiteOrderChannel	Standard	Airborne 750mg Vitamin C Immune Support Supplement Gummies for Adults, Zesty Orange Flavor, Gluten Free Crafted Blend with Powerful Antioxidants Vitamins A C & E, 63 Gummies (3 Pack)	RB-19624-3PK	B071ZJCP9K	3	Shipped	1	USD	49.75	5.1							TORRANCE	CA	90503-2539	US			false				false		false		false
111-0820002-3406624	111-0820002-3406624	2025-07-22T14:54:10+00:00	2025-07-22T22:40:19+00:00	Shipped	Amazon	Amazon.com		Expedited	K-Y Liquid Classic Water-Based Body Friendly Formula 4.5 Fl Oz Personal Lubricant for Wetter Sex for Men, Women and Couples & Safe to Use with Latex C	IB-60007-3PK-FBA	B0108HF81K		Shipped	1	USD	32.99	2.47	1.0					1.0	LAKEWOOD	CO	80232-7211	US			false				false		false		false
112-3455268-5800217	5439736	2025-07-22T14:53:34+00:00	2025-07-22T21:05:31+00:00	Shipped	Merchant	Amazon.com	WebsiteOrderChannel	Standard	Schiff Glucosamine 2000mg with Vitamin D3 and Hyaluronic Acid, 150 Tablets - Joint Supplement (Pack of 3)	RB-19618-3PK	B00HA89W8G	3	Shipped	1	USD	37.49	1.87							BIG BEND	WI	53103-9569	US			false				false		false		false
113-5311921-7878638	5439735	2025-07-22T14:53:23+00:00	2025-07-22T21:05:30+00:00	Shipped	Merchant	Amazon.com	WebsiteOrderChannel	Standard	Veet Leg and Body Hair Remover Cold Wax Strips, 40 ct (Pack of 3)	PBP-50010-3PK	B00X8K6IPA	1	Shipped	1	USD	27.99	2.31							HOUSTON	TX	77074-4919	US			false				false		false		false
113-6346558-1669036	113-6346558-1669036	2025-07-22T14:53:06+00:00	2025-07-23T09:36:51+00:00	Shipped	Amazon	Amazon.com		Expedited	D-Con No View, No Touch Covered Mouse Trap, 6 Pack (2 Traps Each) (Packaging May Vary)	HYD-8001-6PK-FBA	B07Q86VPBY		Shipped	1	USD	30.6	2.07	2.99					2.99	VERMILION	OH	44089-1105	US			false				false		false		false
113-2171072-2784206	113-2171072-2784206	2025-07-22T14:52:22+00:00	2025-07-23T07:12:06+00:00	Shipped	Amazon	Amazon.com		Expedited	K-Y Liquibeads Silicone-Based Formula 6 Bead Inserts and 6 Applicators Vaginal Moisturizer & Lube for More Comfortable Sex For Men, Women and Couples	IB-60001-3PK-FBA	B010MJNMK8		Shipped	1	USD	37.99	2.66							PEMBROKE PINES	FL	33023-1257	US			false				false		false		false
112-9240697-7351410	5439734	2025-07-22T14:51:22+00:00	2025-07-22T21:05:31+00:00	Shipped	Merchant	Amazon.com	WebsiteOrderChannel	Standard	Digestive Advantage Lactose Defense Enzymes + Probiotics for Women & Men Occasional Bloating, Lactose Breakdown, Minor Abdominal Discomfort, Immune Support, 96 Count Capsules (3 Pack)	RB-19632-3PK	B0BX17TNH2	3	Shipped	1	USD	58.49	0.58							CARTHAGE	IL	62321-1309	US			false				false		false		false
113-9707226-3577850	5439733	2025-07-22T14:50:23+00:00	2025-07-23T15:40:41+00:00	Shipped	Merchant	Amazon.com	WebsiteOrderChannel	Standard	Schiff Glucosamine with Vitamin D3 & Hyaluronic Acid, 2000mg of Glucosamine, Joint Care Supplement Helps Lubricate & Protect Joints*, 150 Count (Pack of 2)	RB-19618-2PK	B00GKQOW70	2	Shipped	1	USD	26.5	2.52							PENCIL BLUFF	AR	71965-8023	US			false				false		false		false
111-1520128-0619441	5439732	2025-07-22T14:50:03+00:00	2025-07-22T21:05:28+00:00	Shipped	Merchant	Amazon.com	WebsiteOrderChannel	Standard	MegaRed 350mg Omega 3 Supplement with EPA/DHA, Astaxanthin & Phospholipids, No Fish Oil Aftertaste Supports Heart, Brain, Joint and Eye Health, 120 Count Softgels (2 Pack)	RB-19650-2PK	B0BX1GWXBB	2	Shipped	1	USD	59.99								MIAMI	FL	33172-6313	US			false				false		false		false
114-0757554-5401059	114-0757554-5401059	2025-07-22T14:49:52+00:00	2025-07-23T19:39:45+00:00	Shipped	Amazon	Amazon.com		Expedited	K-Y Liquibeads Silicone-Based Formula 6 Bead Inserts and 6 Applicators Vaginal Moisturizer & Lube for More Comfortable Sex For Men, Women and Couples	IB-60001-3PK-FBA	B010MJNMK8		Shipped	1	USD	37.99	2.28							BALTIMORE	MD	21209-4638	US			false				false		false		false
114-5856996-2377057	5439731	2025-07-22T14:49:40+00:00	2025-07-22T22:30:12+00:00	Shipped	Merchant	Amazon.com	WebsiteOrderChannel	Standard	Digestive Advantage, Probiotic Gummy for Adults, 60 Gummies, Gluten-Free, Survives 100x Better, Assorted Fruit Flavors, Supports Digestive Health	RB-19630	B007S50LLI	1	Shipped	1	USD	17.61								SAN ANTONIO	TX	78253-6158	US			false				false		false		false
111-3289871-6949002	5439730	2025-07-22T14:49:30+00:00	2025-07-23T06:34:46+00:00	Shipped	Merchant	Amazon.com	WebsiteOrderChannel	SecondDay	Jarrow Formulas CoQ10 200mg Softgels - 60 Day Supply, Ubiquinol Co Q 10 Supplement for Cardiovascular Health, 60 Softgels	JF-10003	B004VCOOWS	1	Shipped	2	USD	109.14	6.82	2.0						ESSEX	MA	01929-1317	US			false				false		false		false
113-9388825-8765067	5439729	2025-07-22T14:48:49+00:00	2025-07-25T07:00:03+00:00	Shipped	Merchant	Amazon.com	WebsiteOrderChannel	Standard	Airborne 750mg Vitamin C Immune Support Supplement Gummies for Adults, Zesty Orange Flavor, Gluten Free Crafted Blend with Powerful Antioxidants Vitamins C & E, 42 Gummies (2 Pack)	RB-19579-2PK	B01LYXHMSW	2	Shipped	1	USD	27.98								KATY	TX	77494-6633	US			false				false		false		false
114-8123071-0516239	5439728	2025-07-22T14:48:39+00:00	2025-07-22T21:05:28+00:00	Shipped	Merchant	Amazon.com	WebsiteOrderChannel	Standard	Airborne 750mg Vitamin C Immune Support Supplement Gummies for Adults, Assorted Fruit Flavor, Gluten Free Crafted Blend with Powerful Antioxidants Vitamins A C & E, 42 Gummies (2 Pack)	RB-19577-2PK	B00O3IBF2M	2	Shipped	1	USD	28.49								ORLANDO	FL	32832-6949	US			false				false		false		false
113-3077424-9392217	5439727	2025-07-22T14:48:24+00:00	2025-07-22T23:59:44+00:00	Shipped	Merchant	Amazon.com	WebsiteOrderChannel	Standard	Lysol Air Sanitizer Spray, For Air Sanitization and Odor Elimination, White Linen, Simple Fresh, Light Breeze 10 Fl. Oz (Pack of 3)	HYL-8512-WSL-3PK	B0D2K4QX71	3	Shipped	1	USD	35.99	2.88							Brookhaven	GA	30319	US			true	VEG0176236			false		false		false
112-3371003-3321809	112-3371003-3321809	2025-07-22T14:48:22+00:00	2025-07-22T20:54:36+00:00	Shipped	Amazon	Amazon.com		Expedited	D-Con No View, No Touch Covered Mouse Trap, 6 Pack (2 Traps Each) (Packaging May Vary)	HYD-8001-6PK-FBA	B07Q86VPBY		Shipped	1	USD	30.6	1.68							WISCONSIN DELLS	WI	53965-1504	US			false				false		false		false
113-7099003-7102607	113-7099003-7102607	2025-07-22T14:46:14+00:00	2025-07-23T04:14:01+00:00	Shipped	Amazon	Amazon.com		Expedited	Lysol Fresh Cling Toilet Bowl Cleaner, Forest Rain Scent, 24 Ounces (Pack of 4)	HYL-8501-4PK-FBA	B071PFDPQM		Shipped	2	USD	41.46	3.74							BLAINE	WA	98230-4238	US			true				false		false		false
113-0140778-6335415	113-0140778-6335415	2025-07-22T14:46:01+00:00	2025-07-24T01:59:27+00:00	Shipped	Amazon	Amazon.com		Expedited	D-Con No View, No Touch Covered Mouse Trap, 6 Pack (2 Traps Each) (Packaging May Vary)	HYD-8001-6PK-FBA	B07Q86VPBY		Shipped	1	USD	30.6	1.84							SALVISA	KY	40372-9569	US			false				false		false		false
111-1925476-9130666	111-1925476-9130666	2025-07-22T14:45:54+00:00	2025-07-23T22:18:52+00:00	Shipped	Amazon	Amazon.com		Expedited	Lysol Professional Disinfectant Spray, Crisp Linen, 228oz (12X19oz)	HYL-8513-12PK-FBA	B006U7J3FU		Shipped	1	USD	119.5	12.25							CHICAGO	IL	60624-1232	US			true	04854			false		false		false
113-6752257-1857013	5439726	2025-07-22T14:45:42+00:00	2025-07-22T21:05:26+00:00	Shipped	Merchant	Amazon.com	WebsiteOrderChannel	Standard	Veet Leg and Body Hair Remover Cold Wax Strips, 40 ct (Pack of 3)	PBP-50010-3PK	B00X8K6IPA	1	Shipped	1	USD	27.99	1.96							Margate	FL	33063	US			false				false		false		false
112-3142539-3336200	5439725	2025-07-22T14:44:37+00:00	2025-07-23T18:38:44+00:00	Shipped	Merchant	Amazon.com	WebsiteOrderChannel	Standard	Mucinex InstaSoothe Sore Throat + Cough Relief Alpine Herbs & Mint Flavor, Fast Acting, Cooling Comfort, Powerful Sore Throat Oral Pain Reliever, 40 Medicated Drops (40 Count (Pack of 3))	UB-40020-3PK	B0CQDDYVM7	1	Shipped	1	USD	14.99								Hyde Park	NY	12538-2323	US			false				false		false		false
114-8395630-0126648	114-8395630-0126648	2025-07-22T14:43:50+00:00	2025-07-23T16:12:34+00:00	Shipped	Amazon	Amazon.com		Expedited	Lysol - RAC04675CT Professional Disinfectant Spray, Fresh, 228oz (12X19oz) (Pack of 12)	HYL-8514-12PK-FBA	B0040ZORIW		Shipped	1	USD	119.5								ATHENS	GA	30607-1303	US			true				false		false		false
114-5302201-5933817	5439724	2025-07-22T14:43:41+00:00	2025-07-22T21:05:24+00:00	Shipped	Merchant	Amazon.com	WebsiteOrderChannel	Standard	Jarrow Formulas MK-7 90 mcg - Bioactive Form of Vitamin K2 - 120 Servings (Softgels) - For Bone & Cardiovascular Health - Vitamin K2 MK-7 Dietary Supplement - K2 Vitamin Supplement MK-7 - Gluten Free	JF-10002	B00TOASYM8	1	Shipped	1	USD	30.5								VALRICO	FL	33594-3710	US			false				false		false		false
112-0024513-6558623	5439723	2025-07-22T14:42:43+00:00	2025-07-23T06:49:20+00:00	Shipped	Merchant	Amazon.com	WebsiteOrderChannel	Expedited	Omega-3 Krill Oil and Joint Supplement - Megared Joint Care 60 softgels - EPA/DHA fatty acids, Antioxidants, Hyaluronic acid, No fishy burp aftertaste as with Fish Oil	RB-19559	B008M9XW42	1	Shipped	1	USD	27.49	1.24	10.4	0.47					Arvada	CO	80002	US			false				false		false		false
113-3393136-5953821		2025-07-22T14:42:12+00:00	2025-07-22T15:46:59+00:00	Cancelled	Merchant	Amazon.com	WebsiteOrderChannel	Standard	Lysol Air Sanitizer Spray, For Air Sanitization and Odor Elimination, White Linen, Simple Fresh, Light Breeze 10 Fl. Oz (Pack of 3)	HYL-8512-WSL-3PK	B0D2K4QX71	3		0										Brookhaven	GA	30319	US			true				false		false		false
111-7752692-5391403	5439722	2025-07-22T14:41:25+00:00	2025-07-22T22:44:11+00:00	Shipped	Merchant	Amazon.com	WebsiteOrderChannel	Standard	Airborne 750mg Vitamin C Immune Support Supplement Gummies for Adults, Zesty Orange Flavor, Gluten Free Crafted Blend with Powerful Antioxidants Vitamins A C & E, 63 Gummies (3 Pack)	RB-19624-3PK	B071ZJCP9K	3	Shipped	1	USD	49.75								LA PINE	OR	97739-9646	US			false				false		false		false
113-3359893-0154626	113-3359893-0154626	2025-07-22T14:39:41+00:00	2025-07-22T21:11:22+00:00	Shipped	Amazon	Amazon.com		Expedited	K-Y Liquibeads Silicone-Based Formula 6 Bead Inserts and 6 Applicators Vaginal Moisturizer & Lube for More Comfortable Sex For Men, Women and Couples	IB-60001-3PK-FBA	B010MJNMK8		Shipped	1	USD	37.99	3.13							CONROE	TX	77304-3772	US			false				false		false		false
114-5691892-0518666	5439721	2025-07-22T14:39:21+00:00	2025-07-26T02:49:02+00:00	Shipped	Merchant	Amazon.com	WebsiteOrderChannel	Standard	Jarrow Formulas Lutein 20 mg With Zeaxanthin, Dietary Supplement for Visual Function and Macular Health Support, 120 Softgels, 120 Day Supply	JF-10005	B01LWLIOCL	1	Shipped	1	USD	27.83	2.23							AURORA	CO	80014-1717	US			false				false		false		false
112-5954021-6459411	5439720	2025-07-22T14:39:18+00:00	2025-07-24T06:16:11+00:00	Shipped	Merchant	Amazon.com	WebsiteOrderChannel	SecondDay	Airborne 750mg Vitamin C Immune Support Supplement Gummies for Adults, Zesty Orange Flavor, Gluten Free Crafted Blend with Powerful Antioxidants Vitamins C & E, 42 Gummies (2 Pack)	RB-19579-2PK	B01LYXHMSW	2	Shipped	1	USD	27.98	1.18	12.28	0.52					SAINT LOUIS	MO	63128-3208	US			false				false		false		false
113-2801449-2321861	113-2801449-2321861	2025-07-22T14:39:00+00:00	2025-07-22T14:39:07+00:00	Pending	Amazon	Amazon.com		Standard	Finish - All in 1 - Dishwasher Detergent - Powerball - Dishwashing Tablets - Dish Tabs - Fresh Scent, 94 Count (Pack of 1) - Packaging May Vary	HYF-8107-FBA-NEW	B06XX33G82		Unshipped	1	USD	24.0								Philadelphia	PA	19102	US	FBA Subscribe & Save Discount		false				false		false		false
113-5207887-6340220	113-5207887-6340220	2025-07-22T14:38:10+00:00	2025-07-22T14:38:23+00:00	Pending	Amazon	Amazon.com		Standard	Schiff Glucosamine 1500mg Plus MSM and Hyaluronic Acid, 150 Tablets - Joint Supplement (Pack of 3)	RB-19565-3PK-FBA	B088R9GSZG		Unshipped	3	USD	112.47								NEWARK	CA	94560-5226	US	FBA Subscribe & Save Discount		false				false		false		false
111-6904045-0174611	5439719	2025-07-22T14:37:36+00:00	2025-07-22T21:05:24+00:00	Shipped	Merchant	Amazon.com	WebsiteOrderChannel	Standard	Airborne 750mg Vitamin C Immune Support Supplement Gummies for Adults, Zesty Orange Flavor, Gluten Free Crafted Blend with Powerful Antioxidants Vitamins C & E, 42 Gummies (2 Pack)	RB-19579-2PK	B01LYXHMSW	2	Shipped	1	USD	27.98								POWELL	WY	82435-8814	US			false				false		false		false
113-2681547-4463444	5439718	2025-07-22T14:37:24+00:00	2025-07-22T21:05:24+00:00	Shipped	Merchant	Amazon.com	WebsiteOrderChannel	Standard	Cepacol Extra Strength Sore Throat & Cough Relief Lozenges, 16 Count, Mixed Berry Flavor, Maximum Numbing, Fast Acting Relieves Sore Throat Pain, and Quiets Cough (Pack of 4)	UB-40011-4PK	B01IAIFB0C	1	Shipped	1	USD	16.75	1.46							Casa Grande	Az	85122	US			false				false		false		false
112-2453570-5909826	5439716	2025-07-22T14:36:07+00:00	2025-07-24T21:43:16+00:00	Shipped	Merchant	Amazon.com	WebsiteOrderChannel	Standard	Lysol Air Sanitizer Spray, For Air Sanitization and Odor Elimination, White Linen, Simple Fresh, Light Breeze 10 Fl. Oz (Pack of 3)	HYL-8512-WSL-3PK	B0D2K4QX71	3	Shipped	1	USD	35.99	2.61							WAKE FOREST	NC	27587-9350	US			true				false		false		false
111-5693861-0415466	5439715	2025-07-22T14:33:00+00:00	2025-07-22T21:05:20+00:00	Shipped	Merchant	Amazon.com	WebsiteOrderChannel	SecondDay	Jarrow Formulas CoQ10 200mg Softgels - 60 Day Supply, Ubiquinol Co Q 10 Supplement for Cardiovascular Health, 60 Softgels	JF-10003	B004VCOOWS	1	Shipped	1	USD	54.57	4.23	2.0	0.16					ORANGE	CA	92869-5606	US			false				false		false		false
112-9184252-9914659	112-9184252-9914659	2025-07-22T14:32:23+00:00	2025-07-27T03:48:14+00:00	Shipped	Amazon	Amazon.com		Standard	K-Y Ultragel Premium Water-Based Body Friendly Formula 4.5 Fl Oz. Personal Lubricant for Wetter Sex for Men, Women and Couples & Safe to Use with Sili	IB-60004-2PK-FBA	B001E96MB2		Shipped	1	USD	22.99	1.78	6.99	0.54					DOS PALOS	CA	93620-2240	US			false				false		false		false
114-3701068-5486633	114-3701068-5486633	2025-07-22T14:31:14+00:00	2025-07-23T12:13:55+00:00	Shipped	Amazon	Amazon.com		Expedited	Lysol Air Sanitizer Spray, For Air Sanitization and Odor Elimination, Simple Fresh, Lavender, Cotton Blossom 10 Fl. Oz (Pack of 3)	HYL-8512-SLC-3PK-FBA	B0D2K554JF		Shipped	1	USD	31.99	2.0							GROTON	MA	01450-2068	US			false				false		false		false
114-1631980-7564254	114-1631980-7564254	2025-07-22T14:30:44+00:00	2025-07-23T14:32:10+00:00	Pending	Amazon	Amazon.com		Expedited	Glass Plus Glass Cleaner, 32 fl oz Bottle, Multi-Surface Glass Cleaner (Pack of 3)	HYG-8601-3PK-FBA	B00QVPFOXQ		Unshipped	1	USD	17.25								Ramona	CA	92065	US			false				false		false		false
114-0124518-5737852	114-0124518-5737852	2025-07-22T14:28:29+00:00	2025-07-27T05:46:47+00:00	Shipped	Amazon	Amazon.com		Expedited	Finish - All in 1 - Dishwasher Detergent - Powerball - Dishwashing Tablets - Dish Tabs - Fresh Scent, 94 Count (Pack of 1) - Packaging May Vary	HYF-8107-FBA-NEW	B06XX33G82		Shipped	1	USD	24.0	2.46							BERKELEY	CA	94707-2613	US			false				false		false		false
112-8724102-9977055	5439714	2025-07-22T14:27:51+00:00	2025-07-24T04:48:11+00:00	Shipped	Merchant	Amazon.com	WebsiteOrderChannel	Standard	Clearasil Ultra 5in1 Exfoliating Wash, 6.78 oz. (Pack of 2)	PB-50004-2PK	B06Y1QPLTT	2	Shipped	1	USD	19.39	1.21							BROOKLINE	MA	02445-6038	US			false				false		false		false
114-8463203-1995423	5439713	2025-07-22T14:26:56+00:00	2025-07-22T21:05:21+00:00	Shipped	Merchant	Amazon.com	WebsiteOrderChannel	Standard	Biofreeze UltraFlex Lidocaine Patches Maximum Strength, Patented Technology, Flexible Pain Relief Patch for Lower Back, Lidocaine Patch for Neck, Knee, Shoulder, Large Pain Patches (Large, 8, Count)	TB-30020-2PK	B0DXSBVL5D	1	Shipped	1	USD	30.0								DENTON	TX	76210-2212	US			false				false		false		false
