amazon-order-id	merchant-order-id	purchase-date	last-updated-date	order-status	fulfillment-channel	sales-channel	order-channel	ship-service-level	product-name	sku	asin	number-of-items	item-status	quantity	currency	item-price	item-tax	shipping-price	shipping-tax	gift-wrap-price	gift-wrap-tax	item-promotion-discount	ship-promotion-discount	ship-city	ship-state	ship-postal-code	ship-country	promotion-ids	cpf	is-business-order	purchase-order-number	price-designation	fulfilled-by	is-replacement-order	original-order-id	is-buyer-requested-cancellation	buyer-requested-cancel-reason	signature-confirmation-recommended
112-1062607-5783410	112-1062607-5783410	2025-07-22T19:49:25+00:00	2025-07-23T08:26:46+00:00	Shipped	Amazon	Amazon.com		Expedited	NEURIVA Memory 3D Brain Supplement - Nootropic Capsules for Memory, Focus & Cognitive Function - Short Term, Long Term, & Working Memory Support - 50c	RB-19663-2PK-FBA	B0F3BLZC5X		Shipped	1	USD	109.0	9.54	2.99					2.99	YUCAIPA	CA	92399-2738	US			false				false		false		false
111-7545240-4561061	111-7545240-4561061	2025-07-22T19:48:49+00:00	2025-07-24T01:39:54+00:00	Pending	Amazon	Amazon.com		Expedited	Finish - All in 1 - Dishwasher Detergent - Powerball - Dishwashing Tablets - Dish Tabs - Fresh Scent, 94 Count (Pack of 1) - Packaging May Vary	HYF-8107-FBA-NEW	B06XX33G82		Unshipped	1	USD	24.0								DELRAY BEACH	FL	33483-6718	US			true				false		false		false
113-7389289-5436262	113-7389289-5436262	2025-07-22T19:48:14+00:00	2025-07-23T21:32:11+00:00	Shipped	Amazon	Amazon.com		Expedited	Biofreeze Menthol Pain Relieving Cream 3 OZ Jar (Pack Of 2) For Pain Relief Associated With Sore Muscles, Arthritis, Simple Backaches, And Joint Pain	TB-30006 -2PK-FBA	B07LCFST1D		Shipped	1	USD	24.55	1.84							NEVADA CITY	CA	95959-9774	US			false				false		false		false
114-3031515-5800266	114-3031515-5800266	2025-07-22T19:47:25+00:00	2025-07-23T10:06:42+00:00	Shipped	Amazon	Amazon.com		Expedited	Biofreeze Menthol Pain Relieving Cream 3 OZ Jar (Pack Of 2) For Pain Relief Associated With Sore Muscles, Arthritis, Simple Backaches, And Joint Pain	TB-30006 -2PK-FBA	B07LCFST1D		Shipped	1	USD	24.55	2.01							COLORADO SPRINGS	CO	80906-3058	US			false				false		false		false
112-2547330-8829033	112-2547330-8829033	2025-07-22T19:46:58+00:00	2025-07-23T08:04:36+00:00	Shipped	Amazon	Amazon.com		Expedited	Veet Sensitive Skin Formula with Aloe Vera and Vitamin E, Dermatologically Tested Hair Removal Gel Cream 13.5 Fl Oz. for Legs & Body (3 Pack)	PB-50008-3PK-FBA	B071CYFHXH		Shipped	1	USD	33.99	2.25							Bayonne	NJ	07002	US			false				false		false		false
114-2024578-6853816	114-2024578-6853816	2025-07-22T19:46:47+00:00	2025-07-24T01:02:25+00:00	Shipped	Amazon	Amazon.com		Expedited	Biofreeze Pain Relief Patches, Arthritis Pain Reliver, Knee & Lower Back Pain Relief Patch, Sore Muscle Relief, Neck Pain Relief, FSA Eligible, 3 Pack	TB-30004-3PK-FBA	B07Q39FSMR		Shipped	1	USD	25.55	2.56							SAINT FRANCISVILLE	LA	70775-4329	US			false				false		false		false
114-3019790-5114665	5440222	2025-07-22T19:46:30+00:00	2025-07-22T23:24:33+00:00	Shipped	Merchant	Amazon.com	WebsiteOrderChannel	Standard	Jarrow Formulas MK-7 90 mcg - Bioactive Form of Vitamin K2 - 120 Servings (Softgels) - For Bone & Cardiovascular Health - Vitamin K2 MK-7 Dietary Supplement - K2 Vitamin Supplement MK-7 - Gluten Free	JF-10002	B00TOASYM8	1	Shipped	2	USD	61.0								NORTHVILLE	MI	48167-1255	US			false				false		false		false
114-3074928-1461856	5440221	2025-07-22T19:44:10+00:00	2025-07-23T01:19:25+00:00	Shipped	Merchant	Amazon.com	WebsiteOrderChannel	Standard	Cepacol Extra Strength Sore Throat, 16 Lozenge, 3-pack, Cherry	UB-40026-3PK	B01N75R6B3	3	Shipped	1	USD	13.49	0.74							DEFOREST	WI	53532-2225	US			false				false		false		false
114-9084974-8915401	5440220	2025-07-22T19:43:39+00:00	2025-07-22T23:45:35+00:00	Shipped	Merchant	Amazon.com	WebsiteOrderChannel	Standard	Airborne 1000mg Vitamin C + Zinc Immune Support Supplement Chewable Tablets, Very Berry Flavor with Powerful Antioxidants Vitamins A C & E, 116 Chewable Tablets (2 Pack)	RB-19620-2PK	B0787D4ZG3	2	Shipped	1	USD	38.49	0.87							CHICAGO	IL	60660-3004	US			false				false		false		false
112-4205532-7525862	5440219	2025-07-22T19:42:25+00:00	2025-07-22T23:24:33+00:00	Shipped	Merchant	Amazon.com	WebsiteOrderChannel	Standard	Jarrow Formulas MK-7 90 mcg - Bioactive Form of Vitamin K2 - 120 Servings (Softgels) - For Bone & Cardiovascular Health - Vitamin K2 MK-7 Dietary Supplement - K2 Vitamin Supplement MK-7 - Gluten Free	JF-10002	B00TOASYM8	1	Shipped	1	USD	30.5								NEW YORK	NY	10023-3571	US			false				false		false		false
113-7099338-3931461	5440212	2025-07-22T19:41:19+00:00	2025-07-23T00:41:38+00:00	Shipped	Merchant	Amazon.com	WebsiteOrderChannel	NextDay	Veet Leg and Body Hair Remover Cold Wax Strips, 40 ct (Pack of 3)	PBP-50010-3PK	B00X8K6IPA	1	Shipped	1	USD	27.99	2.45	11.71	1.02					ATASCADERO	CA	93422-5407	US			false				false		false		false
113-5933751-5721033	113-5933751-5721033	2025-07-22T19:41:10+00:00	2025-07-24T04:31:38+00:00	Pending	Amazon	Amazon.com		Expedited	Glass Plus Glass Cleaner, 32 fl oz Bottle, Multi-Surface Glass Cleaner (Pack of 3)	HYG-8601-3PK-FBA	B00QVPFOXQ		Unshipped	1	USD	17.25								HOWELL	NJ	07731-2125	US			false				false		false		false
113-0772108-7660227	5440218	2025-07-22T19:39:35+00:00	2025-07-23T21:23:26+00:00	Shipped	Merchant	Amazon.com	WebsiteOrderChannel	Standard	Lysol To Go Disinfectant Spray, Crisp Linen, Travel Size - 1.5 oz (Pack of 4)	HYL-8518-4PK	B00129JTXM	4	Shipped	1	USD	14.9	1.3							ATWATER	CA	95301	US			false				false		false		false
114-0473714-1085836	114-0473714-1085836	2025-07-22T19:38:17+00:00	2025-07-25T07:25:18+00:00	Shipped	Amazon	Amazon.com		Standard	NEURIVA Memory 3D Brain Supplement - Nootropic Capsules for Memory, Focus & Cognitive Function - Short Term, Long Term, & Working Memory Support - 50c	RB-19663-2PK-FBA	B0F3BLZC5X		Shipped	1	USD	109.0	7.77	6.99	0.52			5.45		LYONS	NE	68038-2532	US	Subscribe and Save Promotion V2		false				false		false		false
111-2286801-3805064	5440217	2025-07-22T19:37:42+00:00	2025-07-27T02:16:17+00:00	Shipped	Merchant	Amazon.com	WebsiteOrderChannel	Standard	Veet Sensitive Formula with Aloe Vera In Shower 13.5 Fl Oz. Hair Removal Cream for Legs & Body (2 Pack)	PB-50017-2PK	B01LXYDELP	2	Shipped	1	USD	24.99	2.22							BRONX	NY	10466-2122	US			false				false		false		false
111-0174346-8825021	5440216	2025-07-22T19:36:43+00:00	2025-07-25T03:02:19+00:00	Shipped	Merchant	Amazon.com	WebsiteOrderChannel	Standard	K-Y Jelly Classic Water-Based Personal Lubricant, Water Based Lube Helps Relieve Discomfort, 7 FL OZ (Pack 0f 2)	IB-60039-2PK	B0DDWHKTXR	2	Shipped	1	USD	21.99	1.32							EPHRATA	PA	17522-9006	US			false				false		false		false
112-8935341-9882628	112-8935341-9882628	2025-07-22T19:36:18+00:00	2025-07-23T01:42:37+00:00	Shipped	Amazon	Amazon.com		Expedited	NEURIVA Memory 3D Brain Supplement - Nootropic Capsules for Memory, Focus & Cognitive Function - Short Term, Long Term, & Working Memory Support - 50c	RB-19663-2PK-FBA	B0F3BLZC5X		Shipped	1	USD	109.0		2.99				5.45	2.99	MUNCY	PA	17756-7039	US	Subscribe and Save Promotion V2		false				false		false		false
114-4810171-7112230	5440215	2025-07-22T19:35:35+00:00	2025-07-23T00:23:46+00:00	Shipped	Merchant	Amazon.com	WebsiteOrderChannel	Standard	Jarrow Formulas速 QH-absorb速 + PQQ, Dietary Supplement, Antioxidant Support for Mitochondrial Biogenesis, Cellular Energy Production and Cardiovascular Health, 60 Softgels, 60 Day Supply	JF-10007	B010EAND4K	1	Shipped	2	USD	105.0	9.34							ATLANTA	GA	30305-3212	US			false				false		false		false
111-6848003-4604225	5440214	2025-07-22T19:34:38+00:00	2025-07-22T23:45:37+00:00	Shipped	Merchant	Amazon.com	WebsiteOrderChannel	Standard	Schiff Glucosamine with Vitamin D3 & Hyaluronic Acid, 2000mg of Glucosamine, Joint Care Supplement Helps Lubricate & Protect Joints*, 150 Count (Pack of 2)	RB-19618-2PK	B00GKQOW70	2	Shipped	1	USD	26.5	1.88							ELKO	NV	89801-2662	US			false				false		false		false
114-1762971-9240233	5440211	2025-07-22T19:33:28+00:00	2025-07-26T06:49:31+00:00	Shipped	Merchant	Amazon.com	WebsiteOrderChannel	Standard	Scalpicin Max Strength Scalp Itch Treatment, 1.5 Ounce (Pack of 4)	PBP-50011-4PK	B01IADYRZ2	4	Shipped	1	USD	30.99								MILLERSVILLE	PA	17551-9664	US			false				false		false		false
113-4059849-5609055	5440210	2025-07-22T19:32:59+00:00	2025-07-23T16:13:48+00:00	Shipped	Merchant	Amazon.com	WebsiteOrderChannel	Standard	Jarrow Formulas速 QH-absorb速 + PQQ, Dietary Supplement, Antioxidant Support for Mitochondrial Biogenesis, Cellular Energy Production and Cardiovascular Health, 60 Softgels, 60 Day Supply	JF-10007	B010EAND4K	1	Shipped	1	USD	52.5	3.68							NEWNAN	GA	30263-4840	US			false				false		false		false
114-3033029-4965862	5440209	2025-07-22T19:31:46+00:00	2025-07-22T20:49:58+00:00	Shipped	Merchant	Amazon.com	WebsiteOrderChannel	Standard	Lysol Disinfectant Spray to Go, Crisp Linen, 1.5 Ounce (Pack of 5)	HYL-8518-5PK	B00QUBDIKC	5	Shipped	1	USD	17.0	1.19							FORT LAUDERDALE	FL	33315-1078	US			false				false		false		false
113-7206015-1930666	5440614	2025-07-22T19:29:59+00:00	2025-07-23T21:04:04+00:00	Shipped	Merchant	Amazon.com	WebsiteOrderChannel	Standard	RID-X Septic Tank Treatment Enzymes, 8 Month Supply Powder (8 Packs x 1 Month Supply), 78.4oz	HYX-8901-8 PK	B06Y37YG84	1	Shipped	1	USD	74.99	4.29							MONTREAL	MO	65591-7682	US			false				false		false		false
112-4537604-3898628	5440208	2025-07-22T19:29:31+00:00	2025-07-22T23:24:26+00:00	Shipped	Merchant	Amazon.com	WebsiteOrderChannel	SecondDay	Jarrow Formulas CoQ10 200mg Softgels - 60 Day Supply, Ubiquinol Co Q 10 Supplement for Cardiovascular Health, 60 Softgels	JF-10003	B004VCOOWS	1	Shipped	1	USD	54.57	3.27	2.0	0.12					SHEPHERDSVILLE	KY	40165-7701	US			false				false		false		false
111-7155414-0967434	5440207	2025-07-22T19:29:02+00:00	2025-07-22T21:06:19+00:00	Shipped	Merchant	Amazon.com	WebsiteOrderChannel	Standard	Jarrow Formulas MK-7 90 mcg - Bioactive Form of Vitamin K2 - 120 Servings (Softgels) - For Bone & Cardiovascular Health - Vitamin K2 MK-7 Dietary Supplement - K2 Vitamin Supplement MK-7 - Gluten Free	JF-10002	B00TOASYM8	1	Shipped	1	USD	30.5	2.67							Riverside	CA	92506	US			false				false		false		false
113-7288992-3920225	113-7288992-3920225	2025-07-22T19:28:45+00:00	2025-07-23T08:44:10+00:00	Shipped	Amazon	Amazon.com		Expedited	D-Con No View, No Touch Covered Mouse Trap, 6 Pack (2 Traps Each) (Packaging May Vary)	HYD-8001-6PK-FBA	B07Q86VPBY		Shipped	1	USD	30.6	1.48							EL RENO	OK	73036-9281	US			false				false		false		false
111-2361720-1293029	111-2361720-1293029	2025-07-22T19:28:40+00:00	2025-07-23T07:06:40+00:00	Shipped	Amazon	Amazon.com		Expedited	Lysol Fresh Cling Toilet Bowl Cleaner, Forest Rain Scent, 24 Ounces (Pack of 4)	HYL-8501-4PK-FBA	B071PFDPQM		Shipped	1	USD	20.73	1.37							KENILWORTH	NJ	07033-1050	US			false				false		false		false
114-8297431-7980269	5440206	2025-07-22T19:28:20+00:00	2025-07-22T23:46:07+00:00	Shipped	Merchant	Amazon.com	WebsiteOrderChannel	Standard	Airborne 750mg Vitamin C Immune Support Supplement Gummies for Adults, Zesty Orange Flavor, Gluten Free Crafted Blend with Powerful Antioxidants Vitamins C & E, 42 Gummies (2 Pack)	RB-19579-2PK	B01LYXHMSW	2	Shipped	1	USD	27.98	0.81							AULT	CO	80610-9720	US			false				false		false		false
111-0666745-0277845	5440205	2025-07-22T19:27:58+00:00	2025-07-23T23:17:58+00:00	Shipped	Merchant	Amazon.com	WebsiteOrderChannel	Standard	Jarrow Formulas MK-7 90 mcg - Bioactive Form of Vitamin K2 - 120 Servings (Softgels) - For Bone & Cardiovascular Health - Vitamin K2 MK-7 Dietary Supplement - K2 Vitamin Supplement MK-7 - Gluten Free	JF-10002	B00TOASYM8	1	Shipped	1	USD	30.5								NEW YORK	NY	10022-2405	US			false				false		false		false
113-7962835-6584236	5440204	2025-07-22T19:27:33+00:00	2025-07-23T04:00:32+00:00	Shipped	Merchant	Amazon.com	WebsiteOrderChannel	Standard	Vitamin C 750mg (per Serving) - Airborne Assorted Fruit Flavored Gummies (63 Count in a Bottle), Gluten-Free Immune Support Supplement with Vitamins A C E, Selenium, Echinacea & Ginger	RB-19623	B01FC2EPLK	1	Shipped	1	USD	20.49	0.61							SALT LAKE CITY	UT	84104-3127	US			false				false		false		false
112-6729948-8072268	5440203	2025-07-22T19:26:25+00:00	2025-07-24T20:55:05+00:00	Shipped	Merchant	Amazon.com	WebsiteOrderChannel	Standard	Schiff Glucosamine with Hyaluronic Acid, 2000mg Glucosamine, Joint Care Supplement Helps Lubricate & Protect Joints*, 150 Count (Pack of 2)	RB-19619-2PK	B001G7QXP2	2	Shipped	2	USD	52.0	0.52							PARIS	IL	61944-1940	US			false				false		false		false
114-9997024-9298603	5440202	2025-07-22T19:25:59+00:00	2025-07-23T02:49:45+00:00	Shipped	Merchant	Amazon.com	WebsiteOrderChannel	Standard	Jarrow Formulas速 QH-absorb速 + PQQ, Dietary Supplement, Antioxidant Support for Mitochondrial Biogenesis, Cellular Energy Production and Cardiovascular Health, 60 Softgels, 60 Day Supply	JF-10007	B010EAND4K	1	Shipped	1	USD	52.5	3.68							ELKHART	IN	46517-8501	US			false				false		false		false
111-2260682-2158656	5440201	2025-07-22T19:25:53+00:00	2025-07-23T15:24:25+00:00	Shipped	Merchant	Amazon.com	WebsiteOrderChannel	Standard	Airborne 1000mg Vitamin C + Zinc Immune Support Supplement Chewable Tablets, Citrus Flavor with Powerful Antioxidants Vitamins A C & E, 116 Chewable Tablets (2 Pack)	RB-19621-2PK	B08F827CKW	2	Shipped	1	USD	38.49	1.0							Leawood	KS	66206	US			false				false		false		false
114-0203881-0777820	5440200	2025-07-22T19:25:42+00:00	2025-07-23T19:35:28+00:00	Shipped	Merchant	Amazon.com	WebsiteOrderChannel	Standard	Airborne 750mg Vitamin C Immune Support Supplement Gummies for Adults, Zesty Orange Flavor, Gluten Free Crafted Blend with Powerful Antioxidants Vitamins C & E, 42 Gummies (2 Pack)	RB-19579-2PK	B01LYXHMSW	2	Shipped	1	USD	27.98	1.18							BURBANK	SD	57010-7041	US			false				false		false		false
112-6032951-9491459	112-6032951-9491459	2025-07-22T19:23:51+00:00	2025-07-23T02:46:29+00:00	Shipped	Amazon	Amazon.com		Expedited	Biofreeze Pain Relief Patches, Arthritis Pain Reliver, Knee & Lower Back Pain Relief Patch, Sore Muscle Relief, Neck Pain Relief, 2 Pack (5 Biofreeze	TB-30004-2PK-FBA	B07Q39D92D		Shipped	1	USD	19.99								Montville	New Jersey	07045	US			false				false		false		false
112-8083673-2137046	5440199	2025-07-22T19:23:38+00:00	2025-07-24T04:53:47+00:00	Shipped	Merchant	Amazon.com	WebsiteOrderChannel	Standard	NEURIVA Brain + Eye Supplement for Memory, Focus & Concentration with Clinically Tested Lutein and Zeaxanthin, Vitamins A C & E + Zinc for Eye Health & Filter Blue Light 30 Count Capsules (2 Pack)	RB-19603-2PK	B09ZQ5Q5RC	2	Shipped	1	USD	56.49	3.78							QUEEN CREEK	AZ	85140-0158	US			false				false		false		false
111-8916541-1091425	111-8916541-1091425	2025-07-22T19:23:26+00:00	2025-07-24T20:56:43+00:00	Shipped	Amazon	Amazon.com		Expedited	Digestive Advantage Lactose Defense Enzymes + Probiotics for Women & Men Occasional Bloating, Lactose Breakdown, Minor Abdominal Discomfort, Immune Su	RB-19632-4PK-FBA	B088RMB84S		Shipped	1	USD	77.0	1.35							NAPERVILLE	IL	60565-2727	US			false				false		false		false
113-4871953-5313808	5440198	2025-07-22T19:22:29+00:00	2025-07-22T21:06:21+00:00	Shipped	Merchant	Amazon.com	WebsiteOrderChannel	Standard	Schiff Glucosamine with Vitamin D3 & Hyaluronic Acid, 2000mg of Glucosamine, Joint Care Supplement Helps Lubricate & Protect Joints*, 150 Count (Pack of 2)	RB-19618-2PK	B00GKQOW70	2	Shipped	1	USD	26.5	2.12							OBETZ	OH	43207-4394	US			false				false		false		false
114-5420590-2069069	114-5420590-2069069	2025-07-22T19:22:01+00:00	2025-07-23T09:32:22+00:00	Pending	Amazon	Amazon.com		Expedited	Biofreeze Pain Relief Patches, Arthritis Pain Reliver, Knee & Lower Back Pain Relief Patch, Sore Muscle Relief, Neck Pain Relief, FSA Eligible, 3 Pack	TB-30004-3PK-FBA	B07Q39FSMR		Unshipped	1	USD	25.55								MIAMI	FL	33165-7805	US			false				false		false		false
112-3995122-6133007	5440197	2025-07-22T19:21:39+00:00	2025-07-24T17:49:09+00:00	Shipped	Merchant	Amazon.com	WebsiteOrderChannel	Standard	Veet Sensitive Formula with Aloe Vera In Shower 13.5 Fl Oz. Hair Removal Cream for Legs & Body (2 Pack)	PB-50017-2PK	B01LXYDELP	2	Shipped	1	USD	24.99	1.66							NEWARK	NJ	07105-3313	US		090.411.317-52	false				false		false		false
114-9188971-9290641	114-9188971-9290641	2025-07-22T19:21:22+00:00	2025-07-22T19:21:30+00:00	Pending	Amazon	Amazon.com		Expedited	Biofreeze Pain Relief Patches, Arthritis Pain Reliver, Knee & Lower Back Pain Relief Patch, Sore Muscle Relief, Neck Pain Relief, FSA Eligible, 3 Pack	TB-30004-3PK-FBA	B07Q39FSMR		Unshipped	3	USD	76.65								FRISCO	TEXAS	75035-2342	US			false				false		false		false
113-1968594-1702623	5440196	2025-07-22T19:20:38+00:00	2025-07-23T09:48:36+00:00	Shipped	Merchant	Amazon.com	WebsiteOrderChannel	Standard	Lysol Pet Odor Eliminator Spray, Sanitizing and Disinfecting Spray for Pet Odors, 15oz (Pack of 3)	HYL-8542-3PK	B09V5RZHWK	3	Shipped	1	USD	29.5	2.62							NEW YORK	NY	10065-6642	US			false				false		false		false
114-9330915-7035427	114-9330915-7035427	2025-07-22T19:19:52+00:00	2025-07-25T05:19:39+00:00	Shipped	Amazon	Amazon.com		Standard	Lysol Professional Disinfectant Spray, Crisp Linen, 228oz (12X19oz)	HYL-8513-12PK-FBA	B006U7J3FU		Shipped	1	USD	119.5	9.86	6.99					6.99	GRAND PRAIRIE	TX	75050-1209	US	US Core Free Shipping Promotion A3JU1FCINF5SD0		true	4565-11-04			false		false		false
112-3264626-1248222	112-3264626-1248222	2025-07-22T19:18:30+00:00	2025-07-23T06:05:22+00:00	Shipped	Amazon	Amazon.com		Expedited	D-Con No View, No Touch Covered Mouse Trap, 6 Pack (2 Traps Each) (Packaging May Vary)	HYD-8001-6PK-FBA	B07Q86VPBY		Shipped	1	USD	30.6	2.22							LOGAN	OH	43138-7539	US			false				false		false		false
112-8077991-6673859	5440195	2025-07-22T19:17:39+00:00	2025-07-25T04:51:31+00:00	Shipped	Merchant	Amazon.com	WebsiteOrderChannel	SecondDay	NEURIVA Original Brain Supplement for Memory, Focus & Concentration + Learning & Accuracy with Clinically Tested Nootropics Phosphatidylserine and Neurofactor, Caffeine Free, 30ct Capsules	RB-19635	B07P6JL7TW	1	Shipped	1	USD	32.49		11.1						WEST OLIVE	MI	49460-9021	US	Amazon PLCC Free-Financing Universal Merchant AFD_e01be481-19a5-453d-a38f-6a		false				false		false		false
111-4115904-0889809	5440194	2025-07-22T19:17:37+00:00	2025-07-23T00:05:43+00:00	Shipped	Merchant	Amazon.com	WebsiteOrderChannel	Standard	Digestive Advantage Lactose Defense Enzymes + Probiotics for Women & Men Occasional Bloating, Lactose Breakdown, Minor Abdominal Discomfort, Immune Support, 96 Count Capsules (3 Pack)	RB-19632-3PK	B0BX17TNH2	3	Shipped	1	USD	58.49								Washington	DC	20003	US			false				false		false		false
114-7007839-7113020	5440193	2025-07-22T19:17:05+00:00	2025-07-22T23:45:43+00:00	Shipped	Merchant	Amazon.com	WebsiteOrderChannel	Standard	Omega-3 Krill Oil and Joint Supplement - Megared Joint Care 60 softgels - EPA/DHA fatty acids, Antioxidants, Hyaluronic acid, No fishy burp aftertaste as with Fish Oil	RB-19559	B008M9XW42	1	Shipped	6	USD	164.94	15.48							SAN JOSE	CA	95148-2127	US			false				false		false		false
113-0898002-8003421	5440192	2025-07-22T19:15:59+00:00	2025-07-22T23:45:42+00:00	Shipped	Merchant	Amazon.com	WebsiteOrderChannel	Standard	Omega-3 Krill Oil and Joint Supplement - Megared Joint Care 60 softgels - EPA/DHA fatty acids, Antioxidants, Hyaluronic acid, No fishy burp aftertaste as with Fish Oil	RB-19559	B008M9XW42	1	Shipped	2	USD	54.98	4.4							Owens Cross Rds	Al	35763	US			false				false		false		false
114-1821788-0818617	5440191	2025-07-22T19:15:53+00:00	2025-07-23T19:08:59+00:00	Shipped	Merchant	Amazon.com	WebsiteOrderChannel	Standard	Lysol To Go Disinfectant Spray, Crisp Linen, Travel Size - 1.5 oz (Pack of 4)	HYL-8518-4PK	B00129JTXM	4	Shipped	1	USD	14.9	1.23							BALD KNOB	AR	72010	US			false				false		false		false
111-9672418-0693824	5440187	2025-07-22T19:15:03+00:00	2025-07-22T20:46:50+00:00	Shipped	Merchant	Amazon.com	WebsiteOrderChannel	Standard	K-Y Warming Jelly Glycerin Based Formula 2.5 Fl Oz. Sensorial Personal Lubricant for Men, Women and Couples & Safe to Use with Latex Condoms (2 Pack)	IB-60011-2PK	B004WONFC0	2	Shipped	1	USD	17.39	1.04							PINCKNEY	MI	48169-8864	US			false				false		false		false
112-5508531-4407449	5440186	2025-07-22T19:14:57+00:00	2025-07-22T23:30:59+00:00	Shipped	Merchant	Amazon.com	WebsiteOrderChannel	Standard	Schiff Glucosamine with Hyaluronic Acid, 2000mg Glucosamine, Joint Care Supplement Helps Lubricate & Protect Joints*, 150 Count (Pack of 2)	RB-19619-2PK	B001G7QXP2	2	Shipped	1	USD	26.0								HOBE SOUND	FL	33455-7889	US			false				false		false		false
111-7303162-1397820	111-7303162-1397820	2025-07-22T19:14:32+00:00	2025-07-23T21:27:16+00:00	Shipped	Amazon	Amazon.com		Expedited	Lysol To Go Bundle - 1.5 Ounce Crisp Linen Disinfectant Spray and Lemon Lime Disinfecting Wipes Flat Pack (15 Count)	HYL-8511-8518-FBA	B0BV3C6BVY		Shipped	1	USD	9.5	0.82							FRANKLIN SQUARE	NY	11010-3341	US			false				false		false		false
113-3267108-2191400	5440213	2025-07-22T19:13:43+00:00	2025-07-23T19:15:22+00:00	Shipped	Merchant	Amazon.com	WebsiteOrderChannel	Standard	Biofreeze UltraFlex Lidocaine Patches Maximum Strength, Patented Technology, Flexible Pain Relief Patch for Lower Back, Lidocaine Patch for Neck, Knee, Shoulder, Large Pain Patches (Large, 8, Count)	TB-30020-2PK	B0DXSBVL5D	1	Shipped	5	USD	150.0								PENDLETON	OR	97801-9417	US			true	97060			false		false		false
112-2490618-4930650	5440185	2025-07-22T19:13:31+00:00	2025-07-27T06:30:06+00:00	Shipped	Merchant	Amazon.com	WebsiteOrderChannel	Standard	Move Free Advanced Plus MSM Coated Tablets, Joint Health Supplement with Glucosamine and Chondroitin, 120 Count, Pack of 2	RB-19633-2PK	B00J5NVDR2	2	Shipped	1	USD	43.56								Laurel	MD	20707	US			false				false		false		false
113-5403414-8541842	5440184	2025-07-22T19:13:22+00:00	2025-07-22T20:46:46+00:00	Shipped	Merchant	Amazon.com	WebsiteOrderChannel	Standard	K-Y Warming Jelly Glycerin Based Formula 2.5 Fl Oz. Sensorial Personal Lubricant for Men, Women and Couples & Safe to Use with Latex Condoms (2 Pack)	IB-60011-2PK	B004WONFC0	2	Shipped	1	USD	17.39	1.39							DALEVILLE	AL	36322-4603	US			false				false		false		false
111-0075787-6455407	5440183	2025-07-22T19:13:20+00:00	2025-07-22T23:45:17+00:00	Shipped	Merchant	Amazon.com	WebsiteOrderChannel	Standard	K-Y Jelly Classic Water-Based Personal Lubricant, Water Based Lube Helps Relieve Discomfort, 7 FL OZ (Pack 0f 2)	IB-60039-2PK	B0DDWHKTXR	2	Shipped	1	USD	21.99	1.32							PHILADELPHIA	PA	19130-2033	US			false				false		false		false
111-6334269-8421055	5440182	2025-07-22T19:13:19+00:00	2025-07-23T19:05:49+00:00	Shipped	Merchant	Amazon.com	WebsiteOrderChannel	Standard	Jarrow Formulas CoQ10 200mg Softgels - 60 Day Supply, Ubiquinol Co Q 10 Supplement for Cardiovascular Health, 60 Softgels	JF-10003	B004VCOOWS	1	Shipped	1	USD	54.57	4.65							St. Louis Park	Minnesota	55416	US			false				false		false		false
113-6013422-1645041	5440181	2025-07-22T19:10:41+00:00	2025-07-23T00:05:22+00:00	Shipped	Merchant	Amazon.com	WebsiteOrderChannel	Standard	Clearasil Stubborn Acne Control 5in1 Exfoliating Wash 6.78 fl. oz., Reduces Blocked Pores, Pimple S (Pack of 5),6.78 Fl Oz (Pack of 5)	PB-50004-5PK	B06Y1RJSL4	5	Shipped	1	USD	38.99	2.34							LOUISVILLE	KY	40228-1860	US			false				false		false		false
114-8316629-7274639	5440180	2025-07-22T19:09:35+00:00	2025-07-23T03:40:18+00:00	Shipped	Merchant	Amazon.com	WebsiteOrderChannel	Standard	Omega-3 Krill Oil and Joint Supplement - Megared Joint Care 60 softgels - EPA/DHA fatty acids, Antioxidants, Hyaluronic acid, No fishy burp aftertaste as with Fish Oil	RB-19559	B008M9XW42	1	Shipped	2	USD	54.98	3.84							WEST POINT	IA	52656-9261	US			false				false		false		false
113-7361707-1330623	5440179	2025-07-22T19:09:30+00:00	2025-07-22T21:06:22+00:00	Shipped	Merchant	Amazon.com	WebsiteOrderChannel	Standard	Schiff Glucosamine with Vitamin D3 & Hyaluronic Acid, 2000mg of Glucosamine, Joint Care Supplement Helps Lubricate & Protect Joints*, 150 Count (Pack of 2)	RB-19618-2PK	B00GKQOW70	2	Shipped	1	USD	26.5	2.12							OBETZ	OH	43207-4394	US			false				false		false		false
114-3465365-0213030		2025-07-22T19:09:26+00:00	2025-07-22T19:11:57+00:00	Cancelled	Merchant	Amazon.com	WebsiteOrderChannel	Standard	Lysol Disinfectant Spray to Go, Crisp Linen, 1.5 Ounce (Pack of 5)	HYL-8518-5PK	B00QUBDIKC	5		0										HOUSTON	TX	77091-3659	US			false				false		false		false
111-8134093-2464247	5440178	2025-07-22T19:08:46+00:00	2025-07-24T03:20:03+00:00	Shipped	Merchant	Amazon.com	WebsiteOrderChannel	Standard	Airborne 1000mg Vitamin C + Zinc Immune Support Supplement Chewable Tablets, Very Berry Flavor with Powerful Antioxidants Vitamins A C & E, 116 Chewable Tablets (2 Pack)	RB-19620-2PK	B0787D4ZG3	2	Shipped	2	USD	76.98	3.58							Montrose	CO	81403-9307	US			false				false		false		false
112-3419856-8269013	5440177	2025-07-22T19:07:57+00:00	2025-07-25T23:57:16+00:00	Shipped	Merchant	Amazon.com	WebsiteOrderChannel	Standard	Digestive Advantage Lactose Defense Enzymes + Probiotics for Women & Men Occasional Bloating, Lactose Breakdown, Minor Abdominal Discomfort, Immune Support, 96 Count Capsules (3 Pack)	RB-19632-3PK	B0BX17TNH2	3	Shipped	1	USD	58.49	4.68							ATHENS	GA	30605-5052	US			false				false		false		false
111-7778407-0574621	5440176	2025-07-22T19:07:00+00:00	2025-07-22T20:26:06+00:00	Shipped	Merchant	Amazon.com	WebsiteOrderChannel	Standard	Airborne 750mg Vitamin C Immune Support Supplement Gummies for Adults, Zesty Orange Flavor, Gluten Free Crafted Blend with Powerful Antioxidants Vitamins A C & E, 63 Gummies (4 Pack)	RB-19624-4PK	B072FRVZTV	4	Shipped	1	USD	65.3	5.22							ATHENS	AL	35613-2324	US			false				false		false		false
